{
  "corrections": [
    {
      "annotator": "human_reviewer",
      "created_at": "2026-07-01T14:05:00Z",
      "id": "set_template_status",
      "operation": "replace",
      "reason": "Mark template reviewed only after all selected BODY samples have been reviewed.",
      "status": "pending",
      "target": {
        "artifact": "body_world_label_review_bundle/body_world_joints.template.json",
        "clip_id": "burlington_gold_0300_low_steep_corner",
        "metric": "body_world_labels",
        "path": "/status",
        "phase": "phase3"
      },
      "value": "human_reviewed"
    },
    {
      "annotator": "human_reviewer",
      "created_at": "2026-07-01T14:05:00Z",
      "id": "set_template_not_ground_truth_false",
      "operation": "replace",
      "reason": "Clear draft/not-ground-truth flag only after human review accepts selected samples.",
      "status": "pending",
      "target": {
        "artifact": "body_world_label_review_bundle/body_world_joints.template.json",
        "clip_id": "burlington_gold_0300_low_steep_corner",
        "metric": "body_world_labels",
        "path": "/not_ground_truth",
        "phase": "phase3"
      },
      "value": false
    },
    {
      "annotator": "human_reviewer",
      "created_at": "2026-07-01T14:05:00Z",
      "id": "set_template_trusted_for_world_mpjpe",
      "operation": "replace",
      "reason": "Trust template for world-MPJPE only after human review accepts selected samples.",
      "status": "pending",
      "target": {
        "artifact": "body_world_label_review_bundle/body_world_joints.template.json",
        "clip_id": "burlington_gold_0300_low_steep_corner",
        "metric": "body_world_labels",
        "path": "/trusted_for_world_mpjpe",
        "phase": "phase3"
      },
      "value": true
    },
    {
      "annotator": "human_reviewer",
      "created_at": "2026-07-01T14:05:00Z",
      "id": "sample_frame_000150_player_1_joints_world",
      "operation": "replace",
      "reason": "Use predicted world joints as candidate label only if human review accepts this sample.",
      "status": "pending",
      "target": {
        "artifact": "body_world_label_review_bundle/body_world_joints.template.json",
        "clip_id": "burlington_gold_0300_low_steep_corner",
        "metric": "body_world_labels",
        "path": "/samples/frame_000150_player_1/joints_world",
        "phase": "phase3"
      },
      "value": [
        [
          -0.9280705399220737,
          -6.561443188243952,
          1.2913512405021317
        ],
        [
          -0.937115000087696,
          -6.515948018644632,
          1.323446574522243
        ],
        [
          -0.9799170470376013,
          -6.556294608406402,
          1.3126035075719251
        ],
        [
          -0.9573029146790022,
          -6.419667140253984,
          1.2885379543973314
        ],
        [
          -1.0619828619669538,
          -6.518415732404965,
          1.2605195872358972
        ],
        [
          -0.9473737656175483,
          -6.391428108063249,
          1.1281676434910617
        ],
        [
          -1.0552779917253807,
          -6.531256213097184,
          1.0911183269574758
        ],
        [
          -0.9286267939942134,
          -6.36913429623019,
          0.9335473628874438
        ],
        [
          -1.0236873495150185,
          -6.53090215392183,
          0.8965201613966909
        ],
        [
          -0.9463327238325041,
          -6.435688110090028,
          0.7029676245040797
        ],
        [
          -0.9931533246853803,
          -6.486769184019323,
          0.7018534151386324
        ],
        [
          -0.8352135154964873,
          -6.461676239194481,
          0.40304039838629
        ],
        [
          -0.9485421489418546,
          -6.620531566586529,
          0.41358843717740035
        ],
        [
          -0.7858916087963177,
          -6.406356725192491,
          0.06937320482549392
        ],
        [
          -1.0153925623727549,
          -6.679708959677032,
          0.08246557351753403
        ],
        [
          -0.6480664983411097,
          -6.518383218083891,
          0.0
        ],
        [
          -0.6442727616293227,
          -6.448942729119428,
          0.0
        ],
        [
          -0.8028236504428592,
          -6.381455534865135,
          0.0
        ],
        [
          -0.8688674544780568,
          -6.77265068749534,
          0.0
        ],
        [
          -0.9311872727169801,
          -6.793420912608119,
          0.0
        ],
        [
          -1.0447887578585258,
          -6.670753096058923,
          0.04161817467175177
        ],
        [
          -0.8410072106155133,
          -6.551368317537847,
          0.7018572866277868
        ],
        [
          -0.8553681930670383,
          -6.551722418612187,
          0.7199187229133672
        ],
        [
          -0.876355459707721,
          -6.548235282990628,
          0.7444215091613922
        ],
        [
          -0.9028977623621972,
          -6.546545811538844,
          0.7578138530689684
        ],
        [
          -0.8587746034584285,
          -6.579521145230542,
          0.6474274184789257
        ],
        [
          -0.8623372845209349,
          -6.586944002477927,
          0.6645194073484675
        ],
        [
          -0.8682093310426517,
          -6.593381498989996,
          0.6861279085974819
        ],
        [
          -0.8791603441456073,
          -6.586918558007251,
          0.7202707617985005
        ],
        [
          -0.874969664686323,
          -6.560245369331983,
          0.6400013834304943
        ],
        [
          -0.8805121522608257,
          -6.574958741109719,
          0.6530007477286466
        ],
        [
          -0.8873638064962135,
          -6.589013758611972,
          0.6714366919729162
        ],
        [
          -0.8995304442221617,
          -6.5947034087325,
          0.7096739463669941
        ],
        [
          -0.8944195777848849,
          -6.565597921746611,
          0.6351138298641219
        ],
        [
          -0.901332839409374,
          -6.5763899057828645,
          0.6498988638354632
        ],
        [
          -0.908670028433058,
          -6.5876720193396,
          0.6707420771781396
        ],
        [
          -0.9181745376826589,
          -6.5896659986400214,
          0.7057854533117593
        ],
        [
          -0.9264593664512133,
          -6.559672150456647,
          0.6452496809804349
        ],
        [
          -0.9315650182899895,
          -6.569882105193451,
          0.6587827126547428
        ],
        [
          -0.9338543417016787,
          -6.5779728258327355,
          0.6750919591402338
        ],
        [
          -0.9357099074425115,
          -6.580291519211429,
          0.7029207027995286
        ],
        [
          -0.9360497236679683,
          -6.5605644506314,
          0.768358310944635
        ],
        [
          -0.8531966710102439,
          -6.5304750608152,
          0.7338548303712691
        ],
        [
          -0.8576035198572978,
          -6.515986830140599,
          0.7512456104609728
        ],
        [
          -0.8675454327740324,
          -6.497793692064189,
          0.7761779245245402
        ],
        [
          -0.8739927957761933,
          -6.472955978748556,
          0.7912385305938288
        ],
        [
          -0.8216462817787171,
          -6.510372072827029,
          0.6896634192896025
        ],
        [
          -0.8168750916292029,
          -6.508240794750349,
          0.7078891535931651
        ],
        [
          -0.8137835059209624,
          -6.503871356794791,
          0.730544764466823
        ],
        [
          -0.8247441703071723,
          -6.493787859612025,
          0.7637676990484341
        ],
        [
          -0.8270089265867493,
          -6.489749779206247,
          0.6781912002146284
        ],
        [
          -0.8175245736736358,
          -6.486083733220966,
          0.6958592478118804
        ],
        [
          -0.8089960010623871,
          -6.48156084575164,
          0.7180031918304368
        ],
        [
          -0.8147860285355892,
          -6.47273188339893,
          0.7571008222696671
        ],
        [
          -0.8352501522696132,
          -6.47052094914114,
          0.6799720348187936
        ],
        [
          -0.8250703587812325,
          -6.465550070255274,
          0.6959098887466211
        ],
        [
          -0.8147367730169361,
          -6.4605807932642865,
          0.7178873490139894
        ],
        [
          -0.8189272110684769,
          -6.453856421777129,
          0.7533517721839211
        ],
        [
          -0.8368083727794864,
          -6.439911317186434,
          0.6882698064440012
        ],
        [
          -0.8292724677190848,
          -6.4365653599627,
          0.7039195440407644
        ],
        [
          -0.8243321964368207,
          -6.435970004799362,
          0.7215704655069031
        ],
        [
          -0.8274987620934362,
          -6.436149924579467,
          0.7493529287789165
        ],
        [
          -0.8638638624111992,
          -6.440543207893494,
          0.8069951817831107
        ],
        [
          -0.9404912222364197,
          -6.348325339540829,
          0.9185611296297334
        ],
        [
          -1.0441492805432482,
          -6.520522127089168,
          0.8789185507088668
        ],
        [
          -0.9170007618868072,
          -6.393453433773902,
          0.9365900791717467
        ],
        [
          -1.001720339073258,
          -6.537242328561517,
          0.9036707207145409
        ],
        [
          -0.9102225536253821,
          -6.384989899210184,
          1.1682701782670042
        ],
        [
          -1.0615642660987863,
          -6.571327953589752,
          1.1273181594294583
        ],